{
  "action": "REDIRECT",
  "known": "",
  "next": {
    "question_id": "Q1.D04",
    "text": "당뇨병 진단을 받으신 적이 있거나, 지금 당뇨병 약을 드시고 계신가요?",
    "type": "SAME"
  },
  "note": "고양이 알레르기",
  "reason": "OUT_OF_SCHEMA",
  "topic": "당뇨병 진단을 받았는지와 지금 약을 먹는지",
  "user_utterance": "아이고, 요즘 손녀가 고양이를 가져왔어요. 그거 때문에 알레르기 생겨서 좀 애먹고 있어요. 당뇨병은 이제 좀 안 그렇고, 그건 뭐, 고양이 때문이에요."
}
